{
  "id": "PE-020",
  "title": "Deployment and CI/CD Engineer",
  "version": "1.0.0",
  "category": "specialized-tools",
  "description": "Generate deployment plans with environment configuration, automated checks, rollback strategies, and verification.",
  "prompt": "Act as a Senior DevOps Engineer specializing in CI/CD and deployment automation.\n\nYour task is to design a deployment pipeline for:\n\nAPPLICATION: {application_name}\nTARGET ENVIRONMENT: {target_environment}\nDEPLOYMENT FREQUENCY: {deployment_frequency}\n\n## CI/CD Pipeline Design\n\n### 1. Source Control Workflow\n\n#### Branching Strategy\n- **main/master:** Production-ready code\n- **develop:** Integration branch\n- **feature/*:** Feature branches\n- **hotfix/*:** Emergency fixes\n\n#### Commit Standards\n- Conventional commits format\n- Signed commits (optional)\n- Pre-commit hooks for linting\n\n### 2. Continuous Integration (CI)\n\n#### Trigger Events\n- Push to any branch\n- Pull request opened/updated\n- Scheduled (nightly builds)\n\n#### CI Pipeline Steps\n\n**Stage 1: Build**\n```yaml\n- name: Build\n  steps:\n    - Checkout code\n    - Setup environment (Node/Python/etc.)\n    - Install dependencies\n    - Build application\n    - Build artifacts\n```\n\n**Stage 2: Test**\n```yaml\n- name: Test\n  steps:\n    - Unit tests\n    - Integration tests\n    - Code coverage check (minimum 80%)\n    - Upload coverage reports\n```\n\n**Stage 3: Quality**\n```yaml\n- name: Quality Checks\n  steps:\n    - Linting (ESLint, Pylint, etc.)\n    - Type checking (TypeScript, mypy)\n    - Security scanning (npm audit, Snyk)\n    - SAST (Static Application Security Testing)\n```\n\n**Stage 4: Package**\n```yaml\n- name: Package\n  steps:\n    - Build Docker image\n    - Tag image with commit SHA\n    - Push to container registry\n    - Generate SBOM (Software Bill of Materials)\n```\n\n### 3. Environments\n\n#### Development\n- **Purpose:** Developers test features\n- **Deploy:** On every push to develop\n- **Data:** Synthetic test data\n- **Access:** Internal only\n\n#### Staging\n- **Purpose:** QA and final validation\n- **Deploy:** On release candidate\n- **Data:** Production-like data (sanitized)\n- **Access:** Internal + select partners\n\n#### Production\n- **Purpose:** Live user traffic\n- **Deploy:** Manual approval after staging validation\n- **Data:** Real user data\n- **Access:** Public\n\n### 4. Environment Configuration\n\n#### Configuration Management\n- Environment variables (never hardcoded)\n- Secrets management (Vault, AWS Secrets Manager)\n- Configuration files per environment\n- Feature flags for gradual rollout\n\n#### Required Configuration\n```yaml\nenvironment:\n  name: production\n  region: us-east-1\n  \napp:\n  port: 3000\n  log_level: info\n  \ndatabase:\n  host: ${DB_HOST}\n  port: 5432\n  name: ${DB_NAME}\n  \nsecrets:\n  db_password: ${DB_PASSWORD}\n  api_key: ${API_KEY}\n```\n\n### 5. Deployment Strategy\n\n#### Blue-Green Deployment\n1. Deploy to green (idle) environment\n2. Run smoke tests on green\n3. Switch traffic from blue to green\n4. Keep blue as rollback target\n5. After validation, blue becomes next green\n\n#### Rolling Deployment\n1. Deploy to 10% of instances\n2. Monitor metrics for 10 minutes\n3. If healthy, deploy to next 25%\n4. Continue until 100%\n5. Rollback if errors detected\n\n#### Canary Deployment\n1. Deploy to canary (1-5% traffic)\n2. Monitor error rates and latency\n3. If stable for 1 hour, promote to 100%\n4. Rollback if metrics degrade\n\n### 6. Pre-Deployment Checks\n\n```yaml\npre_deployment:\n  - name: All tests pass\n    required: true\n  - name: Code coverage >= 80%\n    required: true\n  - name: No critical security vulnerabilities\n    required: true\n  - name: Database migrations are backward compatible\n    required: true\n  - name: Dependencies are up to date\n    required: false\n  - name: Staging validation passed\n    required: true (for production)\n```\n\n### 7. Deployment Steps\n\n```yaml\ndeployment:\n  1_pre_deployment:\n    - Create deployment record\n    - Notify team (Slack/Discord)\n    - Take database backup\n    - Scale up capacity (if needed)\n  \n  2_database_migration:\n    - Run migrations in transaction\n    - Verify migration success\n    - Rollback if migration fails\n  \n  3_application_deployment:\n    - Pull latest image\n    - Update environment variables\n    - Deploy new version\n    - Wait for health checks\n  \n  4_post_deployment:\n    - Run smoke tests\n    - Monitor error rates\n    - Monitor latency\n    - Verify critical paths\n  \n  5_finalize:\n    - Update status (success/failed)\n    - Notify team\n    - Tag release in Git\n    - Update documentation\n```\n\n### 8. Health Checks\n\n#### Application Health Endpoint\n```javascript\nGET /health\n\nResponse:\n{\n  \"status\": \"healthy\",\n  \"version\": \"1.2.3\",\n  \"checks\": {\n    \"database\": \"ok\",\n    \"cache\": \"ok\",\n    \"external_api\": \"ok\"\n  },\n  \"uptime\": 3600\n}\n```\n\n#### Readiness Check\n- Application is running\n- Database is connected\n- Dependencies are available\n- Can serve traffic\n\n#### Liveness Check\n- Application is responsive\n- Not in deadlock\n- Not out of memory\n\n### 9. Monitoring and Alerting\n\n#### Key Metrics\n- **Error Rate:** < 0.1%\n- **Response Time (p95):** < 500ms\n- **Throughput:** Requests per second\n- **CPU Usage:** < 80%\n- **Memory Usage:** < 90%\n- **Disk Usage:** < 80%\n\n#### Alerts\n- Error rate spike (>1% for 5 minutes)\n- Latency spike (p95 >1s for 5 minutes)\n- Service down (health check fails)\n- High CPU/Memory (>90% for 10 minutes)\n\n### 10. Rollback Strategy\n\n#### Automated Rollback Triggers\n- Error rate exceeds threshold\n- Critical health check fails\n- Smoke tests fail\n\n#### Manual Rollback Process\n```bash\n# Rollback to previous version\nkubectl rollout undo deployment/app\n\n# Or deploy specific version\ndeploy --version=v1.2.2\n```\n\n#### Rollback Validation\n- Verify rollback succeeded\n- Check metrics return to baseline\n- Notify team\n- Document incident\n\n### 11. Secrets Management\n\n#### Never Commit\n- API keys\n- Database passwords\n- Private keys\n- OAuth tokens\n- Encryption keys\n\n#### Storage\n- Use secrets manager (AWS Secrets, Vault)\n- Rotate secrets regularly\n- Least privilege access\n- Audit secret access\n\n#### Injection\n- Environment variables at runtime\n- Mounted volumes (Kubernetes secrets)\n- Secret management SDKs\n\n### 12. Database Migrations\n\n#### Migration Principles\n- Backward compatible\n- Idempotent (can run multiple times)\n- Tested on staging first\n- Rollback plan for each migration\n\n#### Migration Strategy\n1. Add new column (nullable)\n2. Deploy code that writes to both old and new\n3. Backfill data\n4. Deploy code that reads from new\n5. Remove old column (separate deployment)\n\n### 13. Disaster Recovery\n\n#### Backup Strategy\n- Daily automated backups\n- Retain for 30 days\n- Test restore monthly\n- Store in separate region\n\n#### Recovery Procedures\n1. Assess impact\n2. Communicate to stakeholders\n3. Restore from backup\n4. Verify data integrity\n5. Resume operations\n6. Post-mortem\n\n### 14. Deployment Checklist\n\n**Pre-Deployment**\n- [ ] All tests pass\n- [ ] Code review approved\n- [ ] Security scan passed\n- [ ] Staging validated\n- [ ] Rollback plan documented\n- [ ] Team notified\n- [ ] Backup taken\n\n**During Deployment**\n- [ ] Monitor error rates\n- [ ] Monitor latency\n- [ ] Smoke tests pass\n- [ ] Health checks pass\n\n**Post-Deployment**\n- [ ] Verify critical user flows\n- [ ] Check logs for errors\n- [ ] Monitor for 1 hour\n- [ ] Update changelog\n- [ ] Notify stakeholders\n\n## Output Format\n\n### CI/CD Pipeline Specification\n[Complete pipeline configuration]\n\n### Deployment Plan\n[Step-by-step deployment process]\n\n### Rollback Procedures\n[How to rollback]\n\n### Monitoring Setup\n[Metrics and alerts]\n\n## Definition of Done\n- CI/CD pipeline is fully specified\n- Deployment strategy is chosen\n- Health checks are defined\n- Rollback process is documented\n- Monitoring is configured\n- Secrets management is planned",
  "inputs": [
    {
      "name": "application_name",
      "type": "string",
      "required": true,
      "description": "Name of the application to deploy"
    },
    {
      "name": "target_environment",
      "type": "string",
      "required": true,
      "description": "Deployment target (AWS, GCP, Azure, on-prem)"
    },
    {
      "name": "deployment_frequency",
      "type": "string",
      "required": false,
      "description": "How often to deploy (continuous, daily, weekly)"
    }
  ],
  "output_format": "yaml",
  "quality_checks": [
    "CI/CD pipeline is complete",
    "Deployment strategy is appropriate",
    "Rollback plan is defined",
    "Monitoring and alerts are configured",
    "Secrets are managed securely"
  ],
  "tags": ["devops", "cicd", "deployment", "automation"]
}
