{
  "id": "PE-013",
  "title": "AI Evaluation Framework",
  "version": "1.0.0",
  "category": "ai-prompt-engineering",
  "description": "Create repeatable AI evaluation plans with test cases, scoring rubrics, and failure analysis.",
  "prompt": "Act as a Senior ML Engineer specializing in AI evaluation and quality assurance.\n\nYour task is to design an evaluation framework for:\n\nAI SYSTEM: {ai_system}\nEVALUATION GOALS: {eval_goals}\n\n## Evaluation Framework Design\n\n### 1. Define Evaluation Objectives\n\n- What capabilities are being evaluated?\n- What quality attributes matter? (accuracy, safety, fairness, speed)\n- What are the success criteria?\n- What are the failure modes to detect?\n\n### 2. Test Case Design\n\n#### Test Categories\n\n**Functional Tests**\n- Core functionality works as intended\n- Edge cases are handled\n- Error conditions are managed\n\n**Adversarial Tests**\n- Prompt injection attempts\n- Jailbreak attempts\n- Input that should be rejected\n- Deliberately misleading inputs\n\n**Safety Tests**\n- Harmful content generation\n- Bias and fairness\n- Privacy leakage\n- Inappropriate responses\n\n**Robustness Tests**\n- Typos and misspellings\n- Ambiguous inputs\n- Missing information\n- Contradictory instructions\n\n**Performance Tests**\n- Response time\n- Token usage\n- Throughput\n- Cost per query\n\n#### Test Case Structure\n\nFor each test case:\n```yaml\ntest_case:\n  id: TEST-001\n  category: functional\n  description: \"Clear description\"\n  input: \"Exact input\"\n  expected_behavior: \"What should happen\"\n  pass_criteria: \"Specific measurable criteria\"\n  fail_criteria: \"What constitutes failure\"\n```\n\n### 3. Scoring Rubrics\n\n#### Binary Scoring\n- Pass/Fail for objective criteria\n- Clear decision boundary\n\n#### Ordinal Scoring\n- 1-5 scale for subjective attributes\n- Clear criteria for each score level\n\nExample:\n```\n5: Perfect - Accurate, complete, safe, well-formatted\n4: Good - Minor issues that don't impact correctness\n3: Acceptable - Works but has notable issues\n2: Poor - Significant problems\n1: Fail - Incorrect, unsafe, or unusable\n```\n\n#### Multi-Dimensional Scoring\n\nEvaluate separately:\n- Correctness (factually accurate)\n- Completeness (addresses all parts)\n- Relevance (on-topic, focused)\n- Safety (no harmful content)\n- Clarity (understandable)\n- Efficiency (concise, not verbose)\n\n### 4. Benchmark Datasets\n\n#### Public Benchmarks\n- MMLU (general knowledge)\n- HumanEval (code generation)\n- TruthfulQA (truthfulness)\n- BBH (challenging reasoning)\n- Domain-specific benchmarks\n\n#### Custom Test Sets\n- Real user queries\n- Known failure cases\n- Edge cases specific to your domain\n- Regression tests\n\n#### Test Set Composition\n- Size (minimum 100 for statistical significance)\n- Diversity (cover all capabilities)\n- Difficulty distribution (easy, medium, hard)\n- Balance across categories\n\n### 5. Evaluation Methodology\n\n#### Automated Evaluation\n- Exact match for deterministic outputs\n- Semantic similarity for open-ended responses\n- Rule-based checks (format, length, keywords)\n- LLM-as-judge for complex criteria\n\n#### Human Evaluation\n- Expert review for specialized domains\n- Crowdsourced annotation with quality control\n- Pairwise comparison (A vs B)\n- Inter-rater reliability measurement\n\n#### Hybrid Evaluation\n- Automated screening + human review\n- Human evaluation on subset, extrapolate\n- Continuous monitoring with periodic audits\n\n### 6. Metrics and Analysis\n\n#### Accuracy Metrics\n- Precision, Recall, F1\n- Exact match percentage\n- Semantic similarity scores\n- Task-specific metrics\n\n#### Quality Metrics\n- Average score across dimensions\n- Distribution of scores\n- Failure rate by category\n- Regression rate\n\n#### Fairness Metrics\n- Performance across demographic groups\n- Bias detection in outputs\n- Disparate impact analysis\n\n#### Efficiency Metrics\n- Tokens per response\n- Latency (p50, p95, p99)\n- Cost per 1000 queries\n- Throughput (queries per second)\n\n### 7. Failure Analysis\n\n#### Categorize Failures\n- Factual errors\n- Reasoning errors\n- Safety violations\n- Format errors\n- Refusal errors (should answer but doesn't)\n- Compliance errors (should refuse but doesn't)\n\n#### Root Cause Analysis\n- What pattern causes this failure?\n- Is it a prompt issue?\n- Is it a model limitation?\n- Is it a data issue?\n\n### 8. Regression Testing\n\n- Maintain test suite of known-good cases\n- Run on every model/prompt change\n- Track metrics over time\n- Alert on degradation\n\n### 9. A/B Testing\n\n- Define control and treatment\n- Randomized assignment\n- Minimum sample size for significance\n- Statistical significance testing\n- Monitor for unintended consequences\n\n### 10. Continuous Monitoring\n\n#### Production Metrics\n- User satisfaction (thumbs up/down)\n- Completion rates\n- Edit rates (how often users modify outputs)\n- Escalation rates (when users abandon)\n\n#### Drift Detection\n- Track metric changes over time\n- Alert on anomalies\n- Periodic model re-evaluation\n\n### 11. Reporting\n\n#### Evaluation Report Structure\n```markdown\n# Evaluation Report\n\n## Summary\n- Overall score: X/100\n- Pass rate: Y%\n- Key findings\n\n## Results by Category\n[Breakdown by test category]\n\n## Failure Analysis\n[Common failure patterns]\n\n## Recommendations\n[Actionable improvements]\n\n## Limitations\n[What was not evaluated]\n```\n\n### 12. Ethical Considerations\n\n- Evaluate for bias and fairness\n- Test with diverse inputs\n- Consider societal impact\n- Document evaluation limitations\n- Avoid gaming metrics\n\n## Output Format\n\n### Evaluation Plan\n```yaml\nevaluation:\n  objectives: [List]\n  test_categories: [List]\n  scoring_method: [Method]\n  sample_size: [Number]\n  evaluation_frequency: [Frequency]\n```\n\n### Test Suite\n[Sample test cases across categories]\n\n### Scoring Rubrics\n[Detailed rubrics for each dimension]\n\n### Analysis Plan\n[How to analyze and report results]\n\n## Definition of Done\n- Evaluation objectives are clear\n- Test cases cover all key scenarios\n- Scoring rubrics are defined\n- Metrics are measurable\n- Reporting format is specified\n- Limitations are documented\n- Never fabricate evaluation results",
  "inputs": [
    {
      "name": "ai_system",
      "type": "string",
      "required": true,
      "description": "AI system to evaluate"
    },
    {
      "name": "eval_goals",
      "type": "string",
      "required": true,
      "description": "What to evaluate and why"
    }
  ],
  "output_format": "structured",
  "quality_checks": [
    "Test cases are comprehensive",
    "Scoring rubrics are clear and measurable",
    "Metrics are appropriate for goals",
    "Failure analysis is included",
    "Limitations are documented"
  ],
  "tags": ["ai-evaluation", "testing", "metrics", "quality-assurance"]
}
